posicao,apelido,data,texto,idioma,pais,latitude,longitude,sigla,lugar,resumo
0,tsfradio,2020-01-22 11:26:04,presidente de taiwan pede transparência à china sobre evolução do coronavírus https://t.co/qfeyzxqqpi em… https://t.co/hh79zndycj,pt,portugal,-9.09904258,38.74751841,PT,lisbon
1,tracosdenanquim,2020-02-01 23:38:37,o presidente pode tbm editar uma mp e regulamentar a quarentena dos brasileiros q estão na china né? ele edita mp pra um bando de coisa,pt,brazil,-47.95588438,-15.82375336,BR,brasília
2,augustoemerson1,2020-02-03 02:45:54,cremos que é equivocada a decisão do governo bolsonaro de quebrar quarentena imposta por governo estrangeiro em ter… https://t.co/mbdr6bzqwx,pt,brazil,-53.0,-11.0,BR,são félix do araguaia
3,ssacarnaval,2020-02-06 19:29:09,"o prefeito de salvador, @acmneto_ confirmou que a avenida sete e curuzu livres para #carnavaldesalvador2020!! e fal… https://t.co/zwv5wzapz2",pt,brazil,-38.4767,-12.9747,BR,salvador
4,forza_alviverde,2020-02-24 15:33:24,"o tempo de descanso de hulk no brasil acaba nesta semana, ainda sem muitas definições a respeito do calendário do f… https://t.co/yfbu4ceg92",pt,brazil,-46.7533124,-23.749408,BR,sao paulo
5,sonandaril,2020-02-28 14:21:46,"o governador da são paulo, joão dória recebeu luiz henrique mandetta, ministro da saúde para planejar contingência… https://t.co/z0shs1ajyo",pt,brazil,-46.7121141,-23.60158655,BR,sao paulo
6,sonandaril,2020-02-28 14:25:38,"o governador da são paulo, joão dória recebeu luiz henrique mandetta, ministro da saúde para planejar contingência… https://t.co/hmyijkuriq",pt,brazil,-46.7121141,-23.60158655,BR,sao paulo
7,marcelo_bettega,2020-03-01 16:07:17,"excelente e esclarecedora entrevista do dr. sidney klajner, presidente do h. albert einstein, sobre a situação atua… https://t.co/hph66zdfjx",pt,brazil,-46.73011667,-23.63024889,BR,sao paulo
8,tsfradio,2020-03-09 20:17:03,ministro francês da cultura infetado com covid-19 https://t.co/z0fbbc4uh6 em https://t.co/mdmhqgtnsp https://t.co/f1mehtvjyy,pt,portugal,-9.09904258,38.74751841,PT,lisbon
9,tsfradio,2020-03-10 14:05:04,covid-19: parlamento espanhol suspende sessão depois de deputado dar positivo https://t.co/m9c979jbuj em… https://t.co/nl3vokilee,pt,portugal,-9.09904258,38.74751841,PT,lisbon
10,diarioanilense1,2020-03-10 15:29:07,bolsonaro diz que 'questão do coronavírus' é 'muito mais fantasia'. covid-19 já matou mais de 4 mil pessoas em todo… https://t.co/fnrq99n5gd,pt,united kingdom,-6.86942823,58.25777605,GB,scotland
11,rangelsjb,2020-03-13 23:37:54,"atenção!!!
governador joão doria através da secretaria de estado e saúde, cancelou todos os eventos oficiais que ag… https://t.co/noyxu9hqay",pt,brazil,-47.86466963,-20.58885508,BR,são joaquim da barra
12,barcharles,2020-03-17 17:58:23,"comunicado covid-19 🚨🦠

é com imensa tristeza que anunciamos a suspensão temporária das atividades do bar charles e… https://t.co/9bjp1gzksx",pt,brazil,-46.68255734,-23.59032523,BR,sao paulo
13,tsfradio,2020-03-18 10:30:03,morreu vieira monteiro. presidente do santander portugal tinha covid-19 https://t.co/fd0jczbuww em… https://t.co/ukdjeyoega,pt,portugal,-9.09904258,38.74751841,PT,lisbon
14,pamsobrinho,2020-03-18 11:18:21,"⚠️⚠️
medidas anunciadas pelo governo #bolsonaro para mitigar os impactos #economicos do #covid_19
.
.
🙋🏼‍♀️ concord… https://t.co/qtck9rsm5v",pt,brazil,-43.9387,-19.9191,BR,belo horizonte
15,arthurdantas07,2020-03-18 18:08:54,"pronunciamento do sr. presidente da república do brasil, covid -19 em santa luzia, paraiba, brazil https://t.co/cfafmr2ccs",pt,brazil,-36.9226,-6.8719800000000015,BR,santa luzia
16,leobarbosacj,2020-03-18 19:12:09,reunião com o prefeito guti e lideranças evangélicas sobre a crise do covid-19 em prefeitura de guarulhos https://t.co/2mwwujspck,pt,brazil,-46.51880051,-23.45272126,BR,guarulhos
17,leobarbosacj,2020-03-18 19:16:21,"reunião com prefeito guti e lideranças evangélicas, sobre a crise do covid-19 em prefeitura de guarulhos https://t.co/4t5uen3mlr",pt,brazil,-46.51880051,-23.45272126,BR,guarulhos
18,clovis_vilela,2020-03-18 19:33:41,"sempre que podem, bolsonaro e seu ministro da economia, paulo guedes, demonstram seu desprezo pela vida do povo.… https://t.co/gqckafzyc2",pt,brazil,-35.7248,-9.6232,BR,maceió
19,virginiameirim,2020-03-18 21:43:31,"o presidente do senado, davi alcolumbre, testou positivo para covid-19. o presidente está sem sintomas severos e se… https://t.co/tst5d5rd7q",pt,brazil,-47.86404499,-15.79847176,BR,brasília
20,idy2016,2020-03-19 17:42:02,"#repost claimontt
• • • • • •
bolsonaro, vc não é mais o presidente, acabou!

#forabolsonaro  #covid_19 em conceiçã… https://t.co/dm7r4a853n",pt,brazil,-41.87357,-22.08318,BR,conceição de macabu
21,franciscocepeda,2020-03-19 18:11:32,"gov. doria jr.
coletiva de imprensa/covid-19
by cepeda francisco/estadão conteúdo em palacio dos bandeirantes https://t.co/dgl2fcjdtg",pt,brazil,-46.7121141,-23.60158655,BR,sao paulo
22,marcioendles,2020-03-19 18:23:59,"tranquilo, lúdico, equilibrado e firme!!! excelente! postura totalmente adequada do gov flaviodino com o momento de… https://t.co/fblhmscpcm",pt,brazil,-44.2061439,-2.5832572,BR,são luís
23,portaljnn,2020-03-19 18:39:53,"trump anuncia que eua vão liberar medicamento para tratar covid-19
👇
o presidente dos eua, donald trump, anunciou q… https://t.co/6pe34lf5br",pt,united states,-82.4646,27.9709,US,tampa
24,franciscocepeda,2020-03-19 19:15:30,"gov. doria jr.
coletiva de imprensa/covid-19
by cepeda francisco/estadão conteúdo em palacio dos bandeirantes https://t.co/vl5kkokuzj",pt,brazil,-46.7121141,-23.60158655,BR,sao paulo
25,idy2016,2020-03-19 20:30:59,"#repost esquerdapensante
• • • • • •
bolsonaro dá o exemplo contrário do que se deve fazer durante uma pandemia e u… https://t.co/4gnvrz1nz7",pt,brazil,-41.87357,-22.08318,BR,conceição de macabu
26,carmempimpinati,2020-03-19 20:51:33,o governo dos eua através de pronunciamento do presidente trump anunciou que  a hidroxicloroquina (hydroxychloroqui… https://t.co/nbmwsho8rr,pt,united states,-80.192,25.7752,US,miami
27,multichaves24hr,2020-03-19 21:55:51,"em pronunciamento nesta quinta-feira (19), o presidente dos estados unidos, donald trump, anunciou que o país encon… https://t.co/lw59kvm4qt",pt,brazil,-48.906470299999995,-28.6230022,BR,jaguaruna
28,sindfarsc,2020-03-20 20:57:53,"fala do presidente americano, donald trump, provoca corrida às farmácias de santa catarina.

ouça a reportagem com… https://t.co/87zlnv69y8",pt,brazil,-48.54914,-27.59838,BR,florianópolis
29,hugoflima,2020-03-21 13:20:22,"distânciamento social é o melhor  a se fazer... vamos fazer a nossa parte. em governador valadares, minas gerais https://t.co/tkmehmqqbm",pt,brazil,-41.9462,-18.8543,BR,governador valadares
30,albert_claudino,2020-03-21 16:06:50,"no twitter, donald trump pediu neste sábado que medicamentos contra a malária sejam usados “imediatamente” para tra… https://t.co/vdiowpbw5w",pt,brazil,-40.12294,-3.22929,BR,morrinhos
31,ramyriasantiago,2020-03-21 19:01:57,prefeito francisco nagib apresenta compras de equipamentos para combater entrada de pessoas com sintomas de coronav… https://t.co/cvhrbbhvip,pt,brazil,-43.89284883,-4.45666077,BR,codó
32,andreneves1,2020-03-21 19:30:35,"estas são as palavras do presidente jairmessiasbolsonaro em entrevista ontem no sbtprogramadoratinho. sim, bolsonar… https://t.co/b6oadm8uvz",pt,brazil,-46.66812,-23.61482,BR,sao paulo
33,carlosdnatas,2020-03-21 21:27:12,vereador andré do lanche (pdt) se coloca a a disposição da sociedade no combate ao coronavírus. em governador ediso… https://t.co/embnlv3am4,pt,brazil,-47.3617,-5.75126,BR,governador edison lobão
34,andersonbragast,2020-03-21 22:14:33,jairmessiasbolsonaro  e ministro da defesa decidem que laboratório químico farmacêutico do exército deve imediatame… https://t.co/1j0zmdwgsf,pt,brazil,-47.9833,-21.1333,BR,sertãozinho
35,richard_maturan,2020-03-21 22:20:52,"reposted from aminhannouche parabéns prefeito, pela didática com que resumiu tudo !!! 
::
#coronavirus #corona… https://t.co/uusomwipiy",pt,brazil,-50.65,-23.1333,BR,cornélio procópio
36,portaljnn,2020-03-21 23:41:12,"governo usará laboratório do exército para produzir cloroquina
👇
o presidente jair bolsonaro divulgou na tarde hoje… https://t.co/8dnfjdrpla",pt,brazil,-53.0,-11.0,BR,são félix do araguaia
37,jonasmelloshow,2020-03-21 23:52:29,"parlamentar do ceará ajudando no combate ao coronavírus

o deputado estadual danniel oliveira (mdb/ce), destinou to… https://t.co/jnkhnqxwxr",pt,brazil,-38.53946432,-3.72295722,BR,fortaleza
38,helio_dias1,2020-03-22 23:44:45,"espiral do silêncio       
                              
jair bolsonaro ontem deu uma importantíssima notícia ao i… https://t.co/v863xkrxyy",pt,brazil,-46.345,-23.5286,BR,poá
39,sindfarsc,2020-03-23 15:23:54,"a medida é desumana, mostra o total descaso do presidente com a população e pode trazer consequências ainda mais tr… https://t.co/48phitvivk",pt,brazil,-48.54914,-27.59838,BR,florianópolis
40,multichaves24hr,2020-03-23 18:25:57,"sem conseguir lidar com o atual momento da país com a pandemia, o presidente jair bolsonaro não está conseguindo li… https://t.co/xepcczmaah",pt,brazil,-49.01427984,-28.47472727,BR,tubarão
41,janiorodrigue01,2020-03-26 17:42:34,"quando a tua geladeira ficar assim(pode ser até sem luz), você vai ver que o presidente estava certo.
•
a fome mata… https://t.co/mwrwkmyo6c",pt,brazil,-35.29908313,-5.75004558,BR,são gonçalo do amarante
42,franciscocepeda,2020-03-26 17:53:45,"gov. doria jr.
coletiva de imprensa/covid-19
by cepeda francisco/folhapress 
#imprensacontraovirus em palacio dos b… https://t.co/imicykj6lz",pt,brazil,-46.7121141,-23.60158655,BR,sao paulo
43,cledirrocha,2020-03-26 18:11:33,"#coronavirus #pandemia #covid #covid19 #pandemia #g1 #bolsonaro em joão pessoa, brazil https://t.co/wooli5enlj",pt,brazil,-34.8627,-7.1207,BR,joão pessoa
44,bolsonarozap,2020-03-26 22:10:32,"hoje pela manhã em frente ao alvorada, bolsonaro perguntou a um grupo “amontoado” de jornalistas: “o que vocês estã… https://t.co/vfphmgt1gs",pt,brazil,-47.822175,-15.79277222,BR,brasília
45,pedroaraujoacai,2020-03-27 22:46:38,prefeito prefeitoaluisio intensifica no combate ao coronavirus em açailândia. parabéns prefeito. em açailândia https://t.co/tp7inbwrpp,pt,brazil,-47.50162953,-4.95396447,BR,açailândia
46,bolsonarozap,2020-03-27 23:23:18,a cidade de nova york parece um campo de guerra. o governador do estado solicitou 30 mil respiradores artificiais p… https://t.co/riakaghtu0,pt,united states,-74.0064,40.7142,US,manhattan
47,sonandaril,2020-03-27 23:56:49,governador e prefeito de sp visitam obra de instalação de hospital de campanha que receberá doentes com coronavírus… https://t.co/casguoockn,pt,brazil,-46.66507396,-23.54756608,BR,sao paulo
48,marinho687,2020-03-28 02:04:52,estado do rio de janeiro. governador wilson witzel: mais 15 dias de distanciamento social a partir de segunda-feira… https://t.co/5rjmdqb1pi,pt,brazil,-43.19144444,-22.90341389,BR,rio de janeiro
49,bolsonarozap,2020-03-29 12:41:54,"distanciamento social em salvador, ba: o povo está faminto, e governador petista envia cestas básicas. agora imagin… https://t.co/kzllquuwt5",pt,brazil,-38.50805556,-12.97194444,BR,salvador
50,genysalvesjr,2020-03-29 23:23:47,"eu sigo a orientação do ministro da saúde.

não há que se comparar a #h1n1 com a #covid19.

#ficaemcasa
e vamos pen… https://t.co/0aa86o3avl",pt,brazil,-46.6333,-23.55,BR,sao paulo
51,marinho687,2020-03-30 09:30:37,o presidente dos eua pediu cautela para a população americana. orientou sobre a importância do distanciamento socia… https://t.co/llr7k0c7qw,pt,united states,-77.03625482,38.89797248,US,washington
52,marileischiavi,2020-03-30 09:54:51,trump diz que pico de mortes por coronavírus será daqui a 2 semanas e pede para população ficar em casa até 30 de a… https://t.co/h9zo1mz7w9,pt,brazil,-46.19313794,-23.52186111,BR,mogi das cruzes
53,_dani_tricolor,2020-03-30 13:38:53,paciência. disse o presidente sobre mortes anunciadas. quem da sua família pode morrer para a economia não parar???… https://t.co/u3hebbjzqg,pt,brazil,-34.95774154,-8.03949355,BR,recife
54,valramos69,2020-03-30 17:11:20,"acreditem... tem médico neurologista retuitando isso.
mas esse irmão do ministro da des-educação não  sabe que a de… https://t.co/pp3krzv2cp",pt,brazil,-49.2699,-25.4346,BR,curitiba
55,edurodriguesrp,2020-03-30 17:12:14,"com a palavra: o ministro da saúde, @mandetta2555 . vamos seguir a recomendação? 

#saude #henriquemandetta… https://t.co/1rit4qyfvv",pt,brazil,-47.8,-21.1667,BR,ribeirão preto
56,redemsrecord,2020-03-30 21:45:18,"prefeito marquinhostrad fala sobre possível decreto do presidente jair bolsonaro, para reabertura do comércio no pa… https://t.co/fblx70y7z3",pt,brazil,-54.6167,-20.45,BR,campo grande
57,redemsrecord,2020-03-30 21:48:01,"prefeito marquinhostrad fala sobre possível decreto do presidente jair bolsonaro, para reabertura do comércio no pa… https://t.co/w5quaxciy8",pt,brazil,-54.6167,-20.45,BR,campo grande
58,drbrenoleite,2020-03-31 15:22:24,"queridos amigos, eleitores do bolsonaro, venho me desculpar com aqueles que se sentiram ofendidos com os calorosos… https://t.co/ls6oiokynb",pt,brazil,-49.32549,-15.739329999999999,BR,jaraguá
59,albertocarlosof,2020-03-31 16:41:49,"#merendaescolar | amigos, vejam onde chegamos, em meio a crise do #coronavirus, repúdio a conduta o prefeito magno… https://t.co/jljbwgtjj8",pt,brazil,-43.35872,-3.74119,BR,chapadinha
60,oxxarope,2020-03-31 17:19:28,o deputado federal ronaldo carletto (pp) apresentou um pacote de medidas que considera essenciais para conter o nov… https://t.co/kxmsoe9em1,pt,brazil,-41.69,-12.52,BR,seabra
61,rocktadi2020,2020-03-31 17:32:19,"programação da globolixo:
07:00 - bom dia corona
08:30 - a culpa é do bolsonaro pelo corona vírus
09:00 - mais víru… https://t.co/i4uqz8bjsu",pt,brazil,-46.6333,-23.55,BR,sao paulo
62,metzkerdm,2020-03-31 17:35:23,"hoje, às 18h, estarei com o dr fernando parente, sócio da guimaraesparenteadv e presidente da abracrimdf, para fala… https://t.co/svjpykjg20",pt,brazil,-40.304768,-20.304098,BR,vitória
63,pastorcleiton,2020-03-31 17:48:56,"""isolamento social. . .  

pensa no presidente da vale s/a se fechava ou não a mina do feijão. o prejuízo seria eno… https://t.co/4oc72vs05r",pt,brazil,-45.4333,-21.55,BR,varginha
64,soi_jairo,2020-03-31 17:52:37,"seguindo orientação do presidente bolsonaro, o ministro sergio moro autorizou o emprego da força nacional de segura… https://t.co/ol5vgzk5mj",pt,brazil,-39.01462,-10.50525,BR,euclides da cunha
65,jamilgomes_,2020-03-31 18:39:42,#tn🌐| prefeito do recife anuncia entrega de 31 uti''s exclusivas para atendimento de covid-19 no hospital da mulher… https://t.co/yuiw4bfwlb,pt,brazil,-34.9100785,-8.0435434,BR,recife
66,locutordudacba,2020-03-31 18:53:33,"jairmessiasbolsonaro 
#bolsonaro 
#gripezinha 
#coronavirus #atleta em salvador, bahia, brazil https://t.co/gyysueg63h",pt,brazil,-38.4767,-12.9747,BR,salvador
67,aguiasemrumo,2020-03-31 19:49:27,"por aguiaemrumo: romulo sanches de oliveira 

quarentena no df será mantida pelo menos até maio, diz governador
pic… https://t.co/mlsioljkuv",pt,brazil,-47.92380377,-15.80071393,BR,brasília
68,blogueirosergio,2020-03-31 20:12:03,"diante do cenário atual de pandemia do coronavírus e da enchente do rio mearim no município, o prefeito edvan brand… https://t.co/fmvlokpdaz",pt,brazil,-44.78065986,-4.22577919,BR,bacabal
69,radiolocalweb,2020-03-31 21:15:20,"daqui a pouco tem a live com prefeito gersinhoromerocaieiras
todas as informações e medidas que estão sendo tomadas… https://t.co/dp3x4cgwyz",pt,brazil,-46.7480551,-23.36444280000001,BR,caieiras
70,bolsonarozap,2020-03-31 21:22:05,"mensagem do governador do estado de nova iorque, andrew cuomo, diante da epidemia do coronavírus. @ boston, massach… https://t.co/13cnq6eblp",pt,united states,-71.0565,42.3577,US,boston
71,consulmaointer,2020-03-31 21:53:24,"o presidente do internacional, marcelo medeiros, foi diagnosticado com o novo coronavírus. nesta terça-feira (31) f… https://t.co/3q29hjatpt",pt,brazil,-51.20297,-30.01193,BR,porto alegre
72,40tener,2020-03-31 22:18:02,"isolamento social kkkk nunca nem vi, vim no mercado comprar leite e sabão e olha a situação, filas de 40 min.… https://t.co/qklaq3jxi9",pt,brazil,-49.2859369,-16.6239429,BR,goiânia
73,betaldi,2020-03-31 23:43:53,"o ministro da saúde orientou o uso de máscaras de pano pela população em geral, para que não faltem as hospitalares… https://t.co/xvnyewyea1",pt,brazil,-46.612120000000004,-22.28572,BR,jacutinga
74,redemsrecord,2020-04-01 22:07:18,"prefeito de campo grande marquinhostrad comenta sobre reabertura do comércio.
.
#pandemia #covid19 #coronavírus… https://t.co/h4wevum9ve",pt,brazil,-54.6167,-20.45,BR,campo grande
75,redemsrecord,2020-04-01 22:17:30,"prefeito de campo grande marquinhostrad comenta sobre reabertura do comércio.
.
#pandemia #covid19 #coronavírus… https://t.co/d3ffiv2r0o",pt,brazil,-54.6167,-20.45,BR,campo grande
76,colunaonline,2020-04-01 22:28:06,"o ano é 2035 o corona vírus não existe a 15 anos, e o então presidente bolsonaro ainda está tentando convencer os p… https://t.co/ftnjbwxukw",pt,brazil,-48.613757799999995,-27.5974935,BR,são josé
77,redemsrecord,2020-04-01 23:10:03,"prefeito de campo grande marquinhos fala sobre retomada gradativa do transporte coletivo.
.
#covid19 #coronavírus… https://t.co/cxjht6t6ji",pt,brazil,-54.6167,-20.45,BR,campo grande
78,joaodej44447572,2020-04-02 00:02:48,"governador rui costa afirma: ""para tentar amenizar os efeitos da guerra contra a covid-19, as 677.524 pessoas q est… https://t.co/q2wwcfbw7l",pt,brazil,-38.4767,-12.9747,BR,salvador
79,tsfradio,2020-04-02 10:13:03,ministro da saúde de israel infetado com covid-19 https://t.co/9ili4pcaxi em https://t.co/mdmhqgtnsp https://t.co/rbcnt4ohqg,pt,portugal,-9.09904258,38.74751841,PT,lisbon
80,redemsrecord,2020-04-02 19:55:12,"adelaidovila presidente da cdl espera que retomada do comércio seja positiva.
.
#comercio #varejo #pandemia… https://t.co/wwf0zmqdst",pt,brazil,-54.6167,-20.45,BR,campo grande
81,redemsrecord,2020-04-02 21:29:07,"adelaidovila presidente da cdl espera que retomada do comércio seja positiva.
.
#comercio #varejo #pandemia… https://t.co/yu5lywsa99",pt,brazil,-54.6167,-20.45,BR,campo grande
82,dozeribeiro,2020-04-03 16:06:00,"isolamento social

presidente da fiep defende manutenção do fechamento do comércio em campina grande

buega gadelha… https://t.co/i30alz5yx5",pt,brazil,-35.8825,-7.2191,BR,campina grande
83,portaljuma,2020-04-03 16:19:25,"°

👉 governador wilson lima recebe kits de epis produzidos pela uea para profissionais de saúde em combate à covid-… https://t.co/xniufkjcnn",pt,brazil,-59.89224399999999,-7.199219500000001,BR,apuí
84,joaodej44447572,2020-04-03 17:13:05,"prefeito da cidade de palmeiras esclarece o caso de coronavírus
juntamente com o prefeito de seabra e da secretária… https://t.co/bp54rdni2r",pt,brazil,-42.05,-11.15,BR,central
85,clovis_vilela,2020-04-03 18:41:31,bolsonaro insiste em negar as recomendações mundiais sobre o isolamento social para conter a pandemia do coronavíru… https://t.co/ublhydcppv,pt,brazil,-35.7248,-9.6232,BR,maceió
86,luisrenatolui,2020-04-03 20:12:29,"minha companheira de ho, muito preocupada com covid-19, economia, bolsonaro, doria, quarentena...… https://t.co/uxob8adygm",pt,brazil,-46.9167,-23.45,BR,santana de parnaíba
87,jornaldopovao,2020-04-04 01:11:23,"coronavírus - apresentamos com o deputado elismar prado algumas medidas urgentes.
#acompanheefiscalize… https://t.co/bld55fllvv",pt,brazil,-43.9387,-19.9191,BR,belo horizonte
88,joaodej44447572,2020-04-04 01:21:45,"itapetinga possui um caso confirmado e com óbito
segundo o prefeito municipal de itapetinga, rodrigo hagge, uma mul… https://t.co/b1lrykeueb",pt,brazil,-40.250209999999996,-15.25426,BR,itapetinga
89,xandemadurobjj,2020-04-04 03:57:56,"aqui no rj o governador fala até em prisão, mas agora vendo a grana curta...
.
.
#vamostrabalhar em em isolamento s… https://t.co/rdf4inb6de",pt,brazil,-43.1975,-22.908,BR,rio de janeiro
90,gpanvechio,2020-04-04 12:10:47,concorda? deixe seu comentário - #mandetta #saude #pandemia #covid19 #coronavirus #politica #eleicoes em osvaldo cr… https://t.co/fsrzj3pwbj,pt,brazil,-50.87249,-21.79711,BR,osvaldo cruz
91,luisadias25,2020-04-04 14:41:16,nosso atual ministro da saúde falando sobre a importância da atuação da odontologia nesse período de pandemia. dire… https://t.co/yp5qzmgo0t,pt,brazil,-43.9387,-19.9191,BR,belo horizonte
92,jvmouran,2020-04-04 21:53:51,"excelentíssimo senhor presidente jairmessiasbolsonaro eu achei o verdadeiro remédio para curar o corona vírus 🦠 
to… https://t.co/2l9od1erkd",pt,brazil,-38.5266,-3.7293,BR,fortaleza
93,advogadathais,2020-04-04 22:45:11,"só gostei da caricatura. ainda sou #forabozo
reposted from @amarildocharges luiz henrique mandetta. médico  oropedi… https://t.co/arqksp05jw",pt,brazil,-44.0532,-19.9316,BR,contagem
94,videres2,2020-04-05 11:07:55,governador proíbe carreatas e passeatas enquanto durar pandemia do coronavírus;url=https://t.co/goittpvhiu em paraí… https://t.co/xuqoaxf94p,pt,brazil,-36.825,-7.16277778,BR,taperoá
95,fkountakis,2020-04-05 17:45:27,"com a orientação do ministro mandetta, da saúde, estou produzindo máscaras de proteção individual, com tecido 100%… https://t.co/5es4xxqb9s",pt,brazil,-46.1014777,-23.37705260000001,BR,guararema
96,neurisnatorosen,2020-04-05 17:48:53,quem zomba do jujum e oração é o diabo. o presidente pediu para que católicos e evangélicos jejuasse por ele nessa… https://t.co/rdhmybm7tz,pt,brazil,-38.665,-3.727,BR,caucaia
97,marinho687,2020-04-05 18:15:40,"o prefeito do rio de janeiro, marcelo crivella, decidiu junto com o gabinete de crise do município contra o coronav… https://t.co/luefelmgkw",pt,brazil,-43.36659429,-23.00113528,BR,rio de janeiro
98,dunavarro,2020-04-05 20:04:28,"aquele olhar de quem descobriu que o presidente fez um chamado para jejum religioso, num país que já está há 3 sema… https://t.co/5t145zn38i",pt,brazil,-45.82734194,-23.17961377,BR,são josé dos campos
99,danielaguiarma,2020-04-05 22:46:39,prefeito de são luís vai ampliar medidas de restrição na tentativa de conter o avanço do novo coronavírus no maranh… https://t.co/9qzdykgnlx,pt,brazil,-44.2061439,-2.5832572,BR,são luís
100,janio_barbosa,2020-04-05 22:53:28,#deprimacomjaniobarbosa - governador de #alagoas #renanfilho prorroga o decreto de emergência que estabelece medida… https://t.co/xajtktrfhj,pt,brazil,-36.6608,-9.7519,BR,arapiraca
101,ccarvalhoamb,2020-04-05 23:22:10,"a @pmvconquista, através do seu prefeito @herzemgusmao , autorizou parcialmente o funcionamento do comércio a parti… https://t.co/mxjwditifd",pt,brazil,-40.83283687,-14.86112995,BR,vitória da conquista
102,rod_bolsonaro,2020-04-06 13:45:08,"governadores witzel, doria, ibaneis, e rodrigo maia já encontraram-se com yang wanming, embaixador da china no bras… https://t.co/vibzirh8ld",pt,brazil,-43.8636,-16.7322,BR,montes claros
103,mabellavor,2020-04-06 14:58:38,"para que o nosso país possa fazer jus ao que diz a sua bandeira.

para o brasil progredir, bolsonaro tem que sair!… https://t.co/462bubepxz",pt,brazil,-43.9387,-19.9191,BR,belo horizonte
104,novo30rp,2020-04-06 18:25:14,urgente: ministro do tse decide levar ao plenário o pedido do novo para poder doar recursos os fundo partidário par… https://t.co/5ndtpzh4po,pt,brazil,-47.8,-21.1667,BR,ribeirão preto
105,lena_patty,2020-04-06 19:04:34,"se é sério isso de demitir o mandetta agora sim, estamos perdidos!!
#forabolsonaro #bolsonarogenocida #fiqueemcasa… https://t.co/qlgl7nbxkv",pt,brazil,-43.20362896,-22.90072768,BR,rio de janeiro
106,mot_oliveira,2020-04-06 19:35:45,"o presidente jair bolsonaro decidiu demitir ainda nesta segunda-feira o ministro da saúde, luiz henrique mandetta,… https://t.co/t7gwumn07h",pt,brazil,-47.9,-15.8,BR,brasília
107,videres2,2020-04-06 19:42:45,"com a saída de mandetta, a confirmar-se, só haverá um responsável pelo sucesso ou insucesso do combate ao coronavír… https://t.co/vpnz3wju4a",pt,brazil,-38.23045,-6.758589999999999,BR,sousa
108,parrascs,2020-04-06 19:57:16,"amigos, assim como o prefeito auricchio e todos os vereadores da base do governo, anuncio que doarei por três meses… https://t.co/lu5a2b9xjf",pt,brazil,-46.5697,-23.6238,BR,são caetano do sul
109,ricardomayeda,2020-04-06 20:12:05,"[porteira aberta]
prefeito afirma que vai tomar medidas drásticas se a população não colaborar

#chargedodia… https://t.co/68sjukkzad",pt,brazil,-54.61665892,-20.465108800000007,BR,campo grande
110,redemsrecord,2020-04-06 20:13:17,"prefeito afirma que caso a quantidade de pessoas infectadas com covid-19 aumente, o comércio terá de fechar as port… https://t.co/kvfz5iaaps",pt,brazil,-54.6167,-20.45,BR,campo grande
111,radiolocalweb,2020-04-06 20:20:29,"brasília — o presidente jair bolsonaro decidiu demitir ainda nesta segunda-feira o ministro da saúde, luiz henrique… https://t.co/zweutvjc1o",pt,brazil,-46.7480551,-23.36444280000001,BR,caieiras
112,claudiomargf,2020-04-07 23:25:19,"bolsonaro, abraçado com os “interésses” do donald trump, e de seu partido republicano, quer enfiar “goela abaixo” d… https://t.co/czf0kxckef",pt,brazil,-50.128609999999995,-29.96357,BR,imbé
